 イリュミナンス, ディアデラマドレ
 イリュミナンス, キャトルフィーユ
 イリュミナンス, スイートサルサ
 イリュミナンス, シャトーブランシュ
 イリュミナンス, パワースポット
 イリュミナンス, フーラブライド
 イリュミナンス, マイネオーラム
 イリュミナンス, バウンスシャッセ
 イリュミナンス, アイスフォーリス
 イリュミナンス, リメインサイレント
 イリュミナンス, フレイムコード
 イリュミナンス, レーヴデトワール
 イリュミナンス, コーディリア
 イリュミナンス, サンシャイン
 イリュミナンス, サトノジュピター
 イリュミナンス, ケイティバローズ
 イリュミナンス, コスモバルバラ
 イリュミナンス, マリアライト
 イリュミナンス, ウインプリメーラ
 イリュミナンス, フェリーチェレガロ
 イリュミナンス, カノン
 イリュミナンス, リラヴァティ
 イリュミナンス, アースライズ
 イリュミナンス, メイショウスザンナ
 イリュミナンス, ベリーフィールズ
 イリュミナンス, レッドセシリア
 イリュミナンス, グレイスフラワー
 イリュミナンス, フィロパトール
 イリュミナンス, アドマイヤギャラン
 イリュミナンス, レッドリヴェール
 イリュミナンス, ノットフォーマル
 イリュミナンス, レイヌドネージュ
 イリュミナンス, ブランネージュ
 イリュミナンス, ショウナンバーキン
 イリュミナンス, ソロデビュー
 イリュミナンス, ノボリディアーナ
 イリュミナンス, スマートレイアー
 イリュミナンス, カフェブリリアント
 イリュミナンス, トーセンソレイユ
 イリュミナンス, カレンケカリーナ
 イリュミナンス, ケイアイエレガント
 イリュミナンス, ゴールデンナンバー
 イリュミナンス, メイショウマンボ
 イリュミナンス, ミナレット
