 ジュエラー, ロジクライ
 ジュエラー, シゲルノコギリザメ
 ジュエラー, アストラエンブレム
 ジュエラー, レオナルド
 ジュエラー, レインボーライン
 ジュエラー, ノーブルマーズ
 ジュエラー, ドゥーカ
 ジュエラー, ショウナンアヴィド
 ジュエラー, ファインニードル
 ジュエラー, キングライオン
 ジュエラー, ツーエムレジェンド
 ジュエラー, ラルク
 ジュエラー, ピースマインド
 ジュエラー, スナークスカイ
 ジュエラー, メイショウシャチ
 ジュエラー, ダンツエンペラー
 ジュエラー, クリノシャンボール
 ジュエラー, シンハライト
 ジュエラー, ラベンダーヴァレイ
 ジュエラー, クィーンズベスト
 ジュエラー, デンコウアンジュ
 ジュエラー, カイザーバル
 ジュエラー, クロコスミア
 ジュエラー, レッドアヴァンセ
 ジュエラー, サクレディーヴァ
 ジュエラー, ウインファビラス
 ジュエラー, エルビッシュ
 ジュエラー, ヴィブロス
 ジュエラー, フォールインラブ
 ジュエラー, ブランボヌール
 ジュエラー, クリノラホール
 ジュエラー, アドマイヤリード
 ジュエラー, アットザシーサイド
 ジュエラー, フロムマイハート
 ジュエラー, クリノサンスーシ
 ジュエラー, バレエダンサー
 ジュエラー, ヘイハチハピネス
 ジュエラー, メジャーエンブレム
 ジュエラー, ビービーバーレル
 ジュエラー, メイショウスイヅキ
 ジュエラー, キャンディバローズ
 ジュエラー, カトルラポール
 ジュエラー, ジープルメリア
 ジュエラー, メイショウバーズ
 ジュエラー, ソルヴェイグ
 ジュエラー, アッラサルーテ
 ジュエラー, パールコード
 ジュエラー, パーシーズベスト
 ジュエラー, ミエノサクシード
 ジュエラー, ビッシュ
 ジュエラー, キンショーユキヒメ
 ジュエラー, ゲッカコウ
 ジュエラー, フロンテアクイーン
 ジュエラー, ダイワドレッサー
 ジュエラー, エンジェルフェイス
 ジュエラー, ネオヴェルザンディ
 ジュエラー, ワンダーピルエット
