 ティルナノーグ, ベルラップ
 ティルナノーグ, ダノンメジャー
 ティルナノーグ, シュヴァルグラン
 ティルナノーグ, フローレスダンサー
 ティルナノーグ, アイオシルケン
 ティルナノーグ, エイシンライダー
 ティルナノーグ, テイエムダンシング
 ティルナノーグ, シャイニングレイ
 ティルナノーグ, コメート
 ティルナノーグ, ブラックバゴ
 ティルナノーグ, ソールインパクト
 ティルナノーグ, エニグマバリエート
 ティルナノーグ, マサハヤドリーム
 ティルナノーグ, タンタアレグリア
 ティルナノーグ, レトロロック
 ティルナノーグ, ディアコンチェルト
 ティルナノーグ, マイネルシュバリエ
 ティルナノーグ, フォワードカフェ
 ティルナノーグ, タイセイアプローズ
 ティルナノーグ, ジャジャウマナラシ
 ティルナノーグ, ナンヨーテンプル
 ティルナノーグ, メイプルレインボー
 ティルナノーグ, リアルスティール
 ティルナノーグ, ドゥラメンテ
 ティルナノーグ, アンビシャス
 ティルナノーグ, ミュゼエイリアン
 ティルナノーグ, アヴニールマルシェ
 ティルナノーグ, コスモナインボール
 ティルナノーグ, ショウボート
 ティルナノーグ, マイネルサクセサー
 ティルナノーグ, シゲルケンカヤマ
 ティルナノーグ, レーヴミストラル
 ティルナノーグ, ヴェラヴァルスター
 ティルナノーグ, ミュゼダルタニアン
 ティルナノーグ, レッドライジェル
 ティルナノーグ, ウェスタールンド
 ティルナノーグ, ストレンジクォーク
 ティルナノーグ, スモークフリー
 ティルナノーグ, トーセンアーネスト
 ティルナノーグ, ビクトリーミノル
 ティルナノーグ, カカドゥ
 ティルナノーグ, センチュリオン
 ティルナノーグ, トーセンスパンキー
 ティルナノーグ, リアファル
 ティルナノーグ, トーセンバジル
 ティルナノーグ, バイガエシ
 ティルナノーグ, ジュンスパーヒカル
 ティルナノーグ, レッドソロモン
 ティルナノーグ, アルバートドック
 ティルナノーグ, タガノエスプレッソ
 ティルナノーグ, サンライズセンス
 ティルナノーグ, サラトガスピリット
 ティルナノーグ, レッドアルティスタ
 ティルナノーグ, マッサビエル
 ティルナノーグ, キロハナ
 ティルナノーグ, ゼンノブレーメン
