 ペルフィカ, クールホタルビ
 ペルフィカ, ダノングラシアス
 ペルフィカ, ウインソワレ
 ペルフィカ, エフェクト
 ペルフィカ, ムーンエクスプレス
 ペルフィカ, レオパルディナ
 ペルフィカ, タガノヴェルリー
 ペルフィカ, オールオブユー
 ペルフィカ, ルアンジュ
 ペルフィカ, ダイワプロパー
 ペルフィカ, ニューエディション
 ペルフィカ, シゲルチャグチャグ
 ペルフィカ, シンフォニア
 ペルフィカ, クイーンズリング
 ペルフィカ, スマートプラネット
 ペルフィカ, ラッフォルツァート
 ペルフィカ, ノーブルヴィーナス
 ペルフィカ, スマートグレイス
 ペルフィカ, グレイスフルワード
 ペルフィカ, バチスタ
 ペルフィカ, ラホーヤビーチ
 ペルフィカ, オーミアリス
 ペルフィカ, コートシャルマン
 ペルフィカ, ウィッシュハピネス
 ペルフィカ, ラクアミ
 ペルフィカ, タッチングスピーチ
 ペルフィカ, ミッキークイーン
 ペルフィカ, トーセンビクトリー
 ペルフィカ, レッツゴードンキ
 ペルフィカ, アンドリエッテ
 ペルフィカ, ディープジュエリー
 ペルフィカ, サンクボヌール
 ペルフィカ, レッドカーラ
 ペルフィカ, テルメディカラカラ
 ペルフィカ, レーヌドブリエ
 ペルフィカ, ティーエスクライ
 ペルフィカ, シングウィズジョイ
 ペルフィカ, ライトファンタジア
 ペルフィカ, プレミオテーラー
 ペルフィカ, メジャーガラメキ
 ペルフィカ, ダンスアミーガ
 ペルフィカ, オツウ
 ペルフィカ, レッドセシリア
 ペルフィカ, ノボリディアーナ
 ペルフィカ, カフェブリリアント
 ペルフィカ, アルマディヴァン
 ペルフィカ, カレンケカリーナ
 ペルフィカ, ゴールデンナンバー
 ペルフィカ, メイショウスザンナ
 ペルフィカ, キャットコイン
 ペルフィカ, ノットフォーマル
 ペルフィカ, レッドリヴェール
 ペルフィカ, アイライン
 ペルフィカ, マジックタイム
 ペルフィカ, ウインプリメーラ
 ペルフィカ, スナッチマインド
 ペルフィカ, ウリウリ
 ペルフィカ, ベルルミエール
 ペルフィカ, レッドオーヴァル
 ペルフィカ, ダンツキャンサー
 ペルフィカ, リーサルウェポン
 ペルフィカ, ヤサカオディール
 ペルフィカ, フレイムコード
 ペルフィカ, ウキヨノカゼ
 ペルフィカ, リメインサイレント
 ペルフィカ, スマートレイアー
 ペルフィカ, ココロノアイ
 ペルフィカ, ストレイトガール
 ペルフィカ, メイショウマンボ
 ペルフィカ, クルミナル
 ペルフィカ, コンテッサトゥーレ
 ペルフィカ, アースライズ
 ペルフィカ, ルージュバック
 ペルフィカ, テンダリーヴォイス
 ペルフィカ, ローデッド
 ペルフィカ, メイショウメイゲツ
 ペルフィカ, トーセンラーク
 ペルフィカ, マキシマムドパリ
 ペルフィカ, ディアマイダーリン
 ペルフィカ, トーセンナチュラル
