 マキオボーラー, オースミムーン
 マキオボーラー, ミヤコデラックス
 マキオボーラー, メイショウアラワシ
 マキオボーラー, ダンツメガヒット
 マキオボーラー, メイショウセイウン
 マキオボーラー, ファイアーシチー
 マキオボーラー, メイショウヨウドウ
 マキオボーラー, ワールドマッチ
 マキオボーラー, マイネルアダマス
 マキオボーラー, リヴゴーシュ
 マキオボーラー, ラガーギアチェンジ
 マキオボーラー, クリノダイコクテン
 マキオボーラー, ドリームセーリング
 マキオボーラー, ビップハテンコウ
 マキオボーラー, ブレイクアウト
 マキオボーラー, ショウリュウバイオ
 マキオボーラー, オジュウチョウサン
 マキオボーラー, タイセイドリーム
 マキオボーラー, ウインヤード
 マキオボーラー, テイエムシシーポス
 マキオボーラー, サンレイデューク
 マキオボーラー, シゲルヒノクニ
 マキオボーラー, マイネルアイザック
 マキオボーラー, マイネルゼーラフ
 マキオボーラー, ラグジードライブ
 マキオボーラー, アップトゥデイト
 マキオボーラー, エイコーンパス
 マキオボーラー, サナシオン
 マキオボーラー, ダンツミュータント
 マキオボーラー, ティリアンパープル
 マキオボーラー, アシュヴィン
 マキオボーラー, ウォンテッド
 マキオボーラー, タニノタキシード
 マキオボーラー, タマモショパン
 マキオボーラー, シゲルキョクチョウ
 マキオボーラー, アポロマーベリック
 マキオボーラー, ルペールノエル
 マキオボーラー, カウウェラ
 マキオボーラー, ルートヴィヒコード
 マキオボーラー, トーセンハナミズキ
 マキオボーラー, ウインイルソーレ
