 メラグラーナ, ネロ
 メラグラーナ, エイシンスパルタン
 メラグラーナ, フミノムーン
 メラグラーナ, アースソニック
 メラグラーナ, ラインハート
 メラグラーナ, セカンドテーブル
 メラグラーナ, ブラヴィッシモ
 メラグラーナ, ラインスピリット
 メラグラーナ, オウノミチ
 メラグラーナ, クリスマス
 メラグラーナ, アンナミルト
 メラグラーナ, ティーハーフ
 メラグラーナ, ペイシャフェリス
 メラグラーナ, ヤマニンプチガトー
 メラグラーナ, レッドアリオン
 メラグラーナ, ホッコーサラスター
 メラグラーナ, ジャストドゥイング
 メラグラーナ, ナックビーナス
 メラグラーナ, ブレイブスマッシュ
 メラグラーナ, バクシンテイオー
 メラグラーナ, コスモドーム
 メラグラーナ, スノードラゴン
 メラグラーナ, トウショウピスト
 メラグラーナ, ウインムート
 メラグラーナ, ブレイズアトレイル
 メラグラーナ, フレイムヘイロー
 メラグラーナ, シャイニングレイ
 メラグラーナ, アクティブミノル
 メラグラーナ, ナリタスターワン
 メラグラーナ, ラヴァーズポイント
 メラグラーナ, トーセンデューク
 メラグラーナ, オメガヴェンデッタ
 メラグラーナ, メイソンジュニア
 メラグラーナ, アルティマブラッド
 メラグラーナ, タイムトリップ
 メラグラーナ, トウショウドラフタ
 メラグラーナ, アリンナ
 メラグラーナ, ファインニードル
 メラグラーナ, ラインミーティア
 メラグラーナ, ダンスディレクター
 メラグラーナ, アドマイヤゴッド
 メラグラーナ, ミッキーラブソング
 メラグラーナ, フィドゥーシア
 メラグラーナ, ワキノブレイブ
 メラグラーナ, ツィンクルソード
 メラグラーナ, プレイズエターナル
 メラグラーナ, ワキノヒビキ
 メラグラーナ, ビップライブリー
 メラグラーナ, イッテツ
 メラグラーナ, ダイシンサンダー
 メラグラーナ, セイウンコウセイ
 メラグラーナ, タマモブリリアン
 メラグラーナ, ソルヴェイグ
 メラグラーナ, ヒルノデイバロー
 メラグラーナ, アットザシーサイド
 メラグラーナ, ジューヌエコール
 メラグラーナ, アルマワイオリ
 メラグラーナ, レッツゴードンキ
 メラグラーナ, レッドファルクス
 メラグラーナ, フィエロ
 メラグラーナ, トーキングドラム
 メラグラーナ, シュウジ
 メラグラーナ, ワンスインナムーン
 メラグラーナ, ブリザード
 メラグラーナ, ビッグアーサー
 メラグラーナ, モンドキャンノ
 メラグラーナ, ダイアナヘイロー
