 トリオンフ, トラスト
 トリオンフ, ブラックオニキス
 トリオンフ, アドマイヤウイナー
 トリオンフ, エトルディーニュ
 トリオンフ, フラワープレミア
 トリオンフ, ジャコマル
 トリオンフ, インヴィクタ
 トリオンフ, タガノアシュラ
 トリオンフ, アンノートル
 トリオンフ, ディープウォーリア
 トリオンフ, コリエドール
 トリオンフ, コパノカーニバル
トリオンフ,クインズミラーグロ
トリオンフ,スズカデヴィアス
トリオンフ,ダッシングブレイズ
トリオンフ,マサハヤドリーム
トリオンフ,サトノスティング
トリオンフ,ハッピーユニバンス
トリオンフ,サトノアリシア
トリオンフ,ケイティープライド
トリオンフ,タイセイサミット
トリオンフ,ストレンジクォーク
トリオンフ,クラリティスカイ
トリオンフ,ヒットザターゲット
トリオンフ,ウインガナドル
トリオンフ,ヤマカツライデン
トリオンフ,ダノンメジャー
トリオンフ,ステイインシアトル
トリオンフ,ナスノセイカン
トリオンフ,トーセンマタコイヤ
トリオンフ,マイスタイル
トリオンフ,ケントオー
トリオンフ,ハクサンルドルフ
トリオンフ,アウトライアーズ
トリオンフ,シャイニープリンス
トリオンフ,ステファノス
トリオンフ,カレンラストショー
トリオンフ,ロッカフラベイビー
トリオンフ,ナイトオブナイツ
トリオンフ,ラインルーフ
トリオンフ,ストロングタイタン
トリオンフ,トリコロールブルー
トリオンフ,マルターズアポジー
トリオンフ,サトノノブレス
トリオンフ,モンドインテロ
トリオンフ,テイエムイナズマ
トリオンフ,タツゴウゲキ
トリオンフ,サトノクロニクル
トリオンフ,マウントゴールド
トリオンフ,レイホーロマンス
トリオンフ,ストーンウェア
トリオンフ,エーティーサンダー
トリオンフ,サンマルティン
トリオンフ,キョウヘイ
トリオンフ,キンショーユキヒメ
トリオンフ,マイネルサージュ
トリオンフ,メドウラーク
トリオンフ,スワーヴリチャード
トリオンフ,ペルシアンナイト
トリオンフ,アルアイン
トリオンフ,ヤマカツエース
トリオンフ,ミッキースワロー
トリオンフ,ダンビュライト
トリオンフ,サトノダイヤモンド
トリオンフ,スマートレイアー
トリオンフ,メートルダール
トリオンフ,ウインブライト
トリオンフ,シュヴァルグラン
トリオンフ,ゴールドアクター
