ムーンクエイク,キャンベルジュニア
ムーンクエイク,サトノアレス
ムーンクエイク,グレーターロンドン
ムーンクエイク,ラインスピリット
ムーンクエイク,リライアブルエース
ムーンクエイク,ウインガニオン
ムーンクエイク,シュウジ
ムーンクエイク,アドマイヤゴッド
ムーンクエイク,テオドール
ムーンクエイク,トウショウピスト
ムーンクエイク,セイウンコウセイ
ムーンクエイク,ビップライブリー
ムーンクエイク,アイライン
ムーンクエイク,ダンスディレクター
ムーンクエイク,ノボバカラ
ムーンクエイク,ダイメイフジ
ムーンクエイク,フィアーノロマーノ
ムーンクエイク,ナックビーナス
ムーンクエイク,ダノンスマッシュ
ムーンクエイク,ペイシャフェリシタ
ムーンクエイク,スターオブペルシャ
ムーンクエイク,レッツゴードンキ
ムーンクエイク,トゥラヴェスーラ
ムーンクエイク,デアレガーロ
ムーンクエイク,ユキノアイオロス
ムーンクエイク,ティーハーフ
ムーンクエイク,クリーンファンキー
ムーンクエイク,タマモブリリアン
ムーンクエイク,ヒルノデイバロー
ムーンクエイク,キングハート
ムーンクエイク,オールインワン
ムーンクエイク,ファインニードル
ムーンクエイク,ラブカンプー
ムーンクエイク,ダイメイプリンセス
ムーンクエイク,ワンスインナムーン
ムーンクエイク,レッドファルクス
ムーンクエイク,アレスバローズ
ムーンクエイク,スノードラゴン
ムーンクエイク,ラッキーバブルズ
