テイエムジンソク,アスカノロマン,2
コスモカナディアン,アスカノロマン,2
モルトベーネ,アスカノロマン,1
サンマルデューク,アスカノロマン,1
クインズサターン,アスカノロマン,3
ゴールデンバローズ,アスカノロマン,1
オールマンリバー,アスカノロマン,1
アスカノロマン,ディアデルレイ,1
アスカノロマン,サングラス,1
アスカノロマン,タガノエスプレッソ,1
アスカノロマン,ローズプリンスダム,1
アスカノロマン,ドラゴンバローズ,1
アスカノロマン,ショウナンアポロン,1
アスカノロマン,シャイニービーム,1
アスカノロマン,サルサディオーネ,1
グレイトパール,アスカノロマン,2
ミツバ,アスカノロマン,3
トップディーヴォ,アスカノロマン,1
ユラノト,アスカノロマン,1
ロンドンタウン,アスカノロマン,1
アルタイル,アスカノロマン,1
ナムラアラシ,アスカノロマン,1
マイティティー,アスカノロマン,1
メイショウウタゲ,アスカノロマン,1
ディアデルレイ,アスカノロマン,1
メイショウスミトモ,アスカノロマン,2
アスカノロマン,モンドインテロ,1
アスカノロマン,マイネルバサラ,2
サンライズソア,アスカノロマン,3
クイーンマンボ,アスカノロマン,1
アスカノロマン,コスモカナディアン,1
アスカノロマン,メイショウウタゲ,1
アスカノロマン,プリンシアコメータ,1
アスカノロマン,ナムラアラシ,1
アスカノロマン,トップディーヴォ,1
アスカノロマン,サンマルデューク,1
アスカノロマン,クリノスターオー,1
アスカノロマン,マイティティー,1
ケイティブレイブ,アスカノロマン,1
オメガパフューム,アスカノロマン,2
ノンコノユメ,アスカノロマン,2
サウンドトゥルー,アスカノロマン,1
アスカノロマン,テーオーエナジー,1
アスカノロマン,タガノゴールド,1
アスカノロマン,オールブラッシュ,1
アスカノロマン,センチュリオン,2
アスカノロマン,カツゲキキトキト,1
アスカノロマン,アポロケンタッキー,2
アスカノロマン,テイエムジンソク,1
アスカノロマン,クリソライト,1
アスカノロマン,シュテルングランツ,1
ルヴァンスレーヴ,アスカノロマン,1
ウェスタールンド,アスカノロマン,1
アンジュデジール,アスカノロマン,1
サンライズノヴァ,アスカノロマン,1
ヒラボクラターシュ,アスカノロマン,1
アスカノロマン,ケイティブレイブ,1
アスカノロマン,インカンテーション,1
アスカノロマン,パヴェル,1
