ミスターメロディ,アンブロジオ,1
アサクサゲンキ,アンブロジオ,1
フロンティア,アンブロジオ,1
アンブロジオ,モズスーパーフレア,1
アンブロジオ,タイセイプライド,1
アンブロジオ,ダノンスマッシュ,1
アンブロジオ,テンクウ,1
アンブロジオ,ドラグーンシチー,1
アンブロジオ,タイセイアベニール,1
アンブロジオ,カイザーメランジェ,1
アンブロジオ,ヒシコスマー,1
アンブロジオ,ダークリパルサー,1
アンブロジオ,アシャカデッシュ,1
アンブロジオ,ムスコローソ,1
アンブロジオ,エールショー,1
カツジ,アンブロジオ,1
ケイアイノーテック,アンブロジオ,1
デルタバローズ,アンブロジオ,1
ゴールドギア,アンブロジオ,1
アイスフィヨルド,アンブロジオ,1
ファストアプローチ,アンブロジオ,1
カシアス,アンブロジオ,1
リョーノテソーロ,アンブロジオ,1
エントシャイデン,アンブロジオ,1
コスモイグナーツ,アンブロジオ,1
カイザーメランジェ,アンブロジオ,1
イサチルルンルン,アンブロジオ,1
ラムセスバローズ,アンブロジオ,1
ペイシャルアス,アンブロジオ,1
