クリンチャー,アルアイン,1
クリンチャー,レイデオロ,1
クリンチャー,モズカッチャン,1
クリンチャー,ケントオー,1
クリンチャー,ディアドラ,1
クリンチャー,ミッキーロケット,2
クリンチャー,クロコスミア,1
クリンチャー,アクションスター,1
クリンチャー,プリメラアスール,1
レインボーライン,クリンチャー,2
サトノクロニクル,クリンチャー,1
クリンチャー,アルバート,2
クリンチャー,カレンミロティック,2
クリンチャー,ヤマカツライデン,2
クリンチャー,シホウ,2
クリンチャー,ムイトオブリガード,1
クリンチャー,スーパーマックス,1
クリンチャー,トミケンスラーヴァ,2
クリンチャー,コウエイワンマン,1
シュヴァルグラン,クリンチャー,1
クリンチャー,チェスナットコート,1
クリンチャー,トーセンバジル,1
クリンチャー,スマートレイアー,1
クリンチャー,トウシンモンステラ,1
クリンチャー,サトノクロニクル,1
クリンチャー,ソールインパクト,1
クリンチャー,ガンコ,1
クリンチャー,ピンポン,1
