ファインニードル,ナックビーナス,3
セイウンコウセイ,ナックビーナス,3
フミノムーン,ナックビーナス,1
カラクレナイ,ナックビーナス,1
ナックビーナス,グレイトチャーター,1
ナックビーナス,セカンドテーブル,1
ナックビーナス,キングハート,4
ナックビーナス,タマモブリリアン,3
ナックビーナス,ロードクエスト,2
ナックビーナス,アレスバローズ,2
ナックビーナス,ユキノアイオロス,3
ナックビーナス,ミッキーラブソング,1
ナックビーナス,アットザシーサイド,1
ナックビーナス,ニシケンモノノフ,1
ナックビーナス,ダイアナヘイロー,3
ナックビーナス,ナリタスターワン,1
ナックビーナス,ラインミーティア,3
キングハート,ナックビーナス,1
ナックビーナス,ダイメイフジ,1
ナックビーナス,ネロ,2
ナックビーナス,ビップライブリー,1
ナックビーナス,レーヌミノル,2
ナックビーナス,ラインスピリット,3
ナックビーナス,フミノムーン,1
ナックビーナス,リエノテソーロ,2
ナックビーナス,スノードラゴン,3
ナックビーナス,ジューヌエコール,3
ナックビーナス,ブレイズアトレイル,1
ナックビーナス,エポワス,2
ナックビーナス,アルティマブラッド,1
ヒルノデイバロー,ナックビーナス,1
ナックビーナス,アドマイヤゴッド,1
ナックビーナス,ワンスインナムーン,1
ナックビーナス,ノットフォーマル,1
ナックビーナス,ノボバカラ,2
ナックビーナス,ティーハーフ,3
ナックビーナス,ライトフェアリー,1
ナックビーナス,ダノンスマッシュ,1
ナックビーナス,ペイシャフェリシタ,1
ナックビーナス,キャンベルジュニア,2
ナックビーナス,スターオブペルシャ,1
ナックビーナス,レッツゴードンキ,1
ナックビーナス,トゥラヴェスーラ,1
ナックビーナス,デアレガーロ,1
ナックビーナス,ムーンクエイク,2
ナックビーナス,クリーンファンキー,1
ナックビーナス,ヒルノデイバロー,2
ナックビーナス,オールインワン,1
レッツゴードンキ,ナックビーナス,3
ナックビーナス,ダンスディレクター,1
ナックビーナス,ブリザード,1
ナックビーナス,セイウンコウセイ,2
ナックビーナス,レッドファルクス,2
ナックビーナス,シャイニングレイ,1
ラブカンプー,ナックビーナス,1
ラインスピリット,ナックビーナス,1
ダイメイプリンセス,ナックビーナス,1
ワンスインナムーン,ナックビーナス,1
ナックビーナス,ラッキーバブルズ,1
グレイスフルリープ,ナックビーナス,1
マテラスカイ,ナックビーナス,1
キタサンミカヅキ,ナックビーナス,1
モーニン,ナックビーナス,1
キングズガード,ナックビーナス,1
テーオーヘリオス,ナックビーナス,1
ニシケンモノノフ,ナックビーナス,1
ウインムート,ナックビーナス,1
ラブバレット,ナックビーナス,1
ネロ,ナックビーナス,1
ノボバカラ,ナックビーナス,1
アンサンブルライフ,ナックビーナス,1
ナックビーナス,ノブワイルド,1
