テイエムジンソク,モルトベーネ,1
コスモカナディアン,モルトベーネ,1
モルトベーネ,サンマルデューク,1
モルトベーネ,クインズサターン,1
モルトベーネ,ゴールデンバローズ,1
モルトベーネ,オールマンリバー,1
モルトベーネ,アスカノロマン,1
モルトベーネ,ディアデルレイ,1
モルトベーネ,サングラス,1
モルトベーネ,タガノエスプレッソ,1
モルトベーネ,ローズプリンスダム,1
モルトベーネ,ドラゴンバローズ,1
モルトベーネ,ショウナンアポロン,1
モルトベーネ,シャイニービーム,1
モルトベーネ,サルサディオーネ,1
ハイランドピーク,モルトベーネ,1
ドリームキラリ,モルトベーネ,1
ミツバ,モルトベーネ,1
ロンドンタウン,モルトベーネ,1
アンジュデジール,モルトベーネ,1
リッカルド,モルトベーネ,1
ブラゾンドゥリス,モルトベーネ,1
ディアデルレイ,モルトベーネ,1
モルトベーネ,ノーブルサターン,1
モルトベーネ,メイショウスミトモ,1
モルトベーネ,アルタイル,1
モルトベーネ,リーゼントロック,1
モルトベーネ,モンドクラッセ,1
サンライズノヴァ,モルトベーネ,1
クインズサターン,モルトベーネ,1
ナムラミラクル,モルトベーネ,1
ユラノト,モルトベーネ,1
ルグランフリソン,モルトベーネ,1
インカンテーション,モルトベーネ,1
ウェスタールンド,モルトベーネ,1
クルーガー,モルトベーネ,1
グレンツェント,モルトベーネ,1
メイショウウタゲ,モルトベーネ,1
ストロングバローズ,モルトベーネ,1
イーグルフェザー,モルトベーネ,1
ラインシュナイダー,モルトベーネ,1
モルトベーネ,パルトネルラーフ,1
モルトベーネ,マイネルオフィール,1
